### ISSUE TITLE
Can't ping through Cloudflare

### ISSUE THREAD

**Issue by anacrolix** [flok99/httping#11]
Something makes Cloudflare upset:

> connected to 104.27.163.135:443 (160 bytes), seq=0 time= 25.60 ms 400 Bad Request

It works with curl. I can't find an option to make httping show me what headers it's sending.

**Comment by flok99** [comment]
Can you either give me the url (preferred) or run strace on it?

**Comment by flok99** [comment]
I tried httpinging a couple of sites behind cloudflare and they all work fine.

**Comment by jimmystridh** [comment]
I am getting this against my cloudflare hosts as well. You can reproduce this against cloudflare.com

```
> httping https://www.cloudflare.com -s
Auto enabling SSL due to https-URLPING www.cloudflare.com:443 (/):
connected to 198.41.215.162:443 (171 bytes), seq=0 time= 29.07 ms 400 Bad Request
connected to 198.41.215.162:443 (171 bytes), seq=1 time= 27.12 ms 400 Bad Request
connected to 198.41.215.162:443 (171 bytes), seq=2 time= 34.54 ms 400 Bad Request
```

**Comment by jimmystridh** [comment]
related, an option like -vv in curl which outputs all headers, could be useful when troubleshooting something like this

**Comment by flok99** [comment]
Cloudflare seems to filter on the browser agent. If I specify one:

10:40:46 folkert@belle:~/git/httping master 7s ±‡ ./httping -I "Mozilla/5.0 (Macintosh; Intel Mac OS X 10_12_5) AppleWebKit/537.36 (KHTML, like Gecko) Chrome/59.0.3071.115 Safari/537.36" https://www.cloudflare.com -s
Auto enabling SSL due to https-URL
PING www.cloudflare.com:443 (/):
connected to 198.41.215.162:443 (1310 bytes), seq=0 time=177.10 ms 200 OK
connected to 198.41.214.162:443 (1165 bytes), seq=1 time= 32.38 ms 200 OK
connected to 198.41.215.162:443 (1165 bytes), seq=2 time= 27.89 ms 200 OK
connected to 198.41.214.162:443 (1165 bytes), seq=3 time= 26.03 ms 200 OK
^CGot signal 2
--- https://www.cloudflare.com/ ping statistics ---
4 connects, 4 ok, 0.00% failed, time 3883ms
round-trip min/avg/max = 26.0/65.9/177.1 ms

So closing this as it is not a bug in httping.

**Comment by hvisage** [comment]
@flok99 It's an interesting issue, and perhaps SNI related??

First httping:

> ➜  ~ httping https://www.cloudflare.com -s -c 3
> Auto enabling SSL due to https-URL
> PING www.cloudflare.com:443 (/):
> connected to 198.41.214.162:443 (1405 bytes), seq=0 time=121.35 ms 200 OK
> connected to 198.41.214.162:443 (1184 bytes), seq=1 time=139.10 ms 200 OK
> connected to 198.41.214.162:443 (1192 bytes), seq=2 time=314.93 ms 200 OK
> --- https://www.cloudflare.com/ ping statistics ---
> 3 connects, 3 ok, 0.00% failed, time 3583ms
> round-trip min/avg/max = 121.4/191.8/314.9 ms
> ➜  ~ httping https://tracks4africa.co.za -s -c 3
> Auto enabling SSL due to https-URL
> PING tracks4africa.co.za:443 (/):
> SSL handshake error: (null)
> WRITE_SSL: io-error: Undefined error: 0
> error sending request to host
> WRITE_SSL: io-error: Undefined error: 0
> error sending request to host
> --- https://tracks4africa.co.za/ ping statistics ---
> 3 connects, 0 ok, 100.00% failed, time 3115ms
> 

So the site behind cloudflare fails, but the cloudflare itself doesn't.
But look at the fun with curl:


> ➜  ~ curl -k https://tracks4africa.co.za
> curl: (35) SSL peer handshake failed, the server most likely requires a client certificate to connect
> ➜  ~ curl -k -4 -v https://tracks4africa.co.za   > /dev/null
> * Rebuilt URL to: https://tracks4africa.co.za/
>   % Total    % Received % Xferd  Average Speed   Time    Time     Time  Current
>                                  Dload  Upload   Total   Spent    Left  Speed
>   0     0    0     0    0     0      0      0 --:--:-- --:--:-- --:--:--     0*   Trying 104.18.54.171...
> * TCP_NODELAY set
> * Connected to tracks4africa.co.za (104.18.54.171) port 443 (#0)
> * WARNING: disabling hostname validation also disables SNI.
> * SSL peer handshake failed, the server most likely requires a client certificate to connect
>   0     0    0     0    0     0      0      0 --:--:-- --:--:-- --:--:--     0
> * Closing connection 0
> curl: (35) SSL peer handshake failed, the server most likely requires a client certificate to connect
> ➜  ~
> 

Notice that handshake failure related to SNI, as Cloudflare you need to specify that for the hosts behind it, as below it "works":

> ➜  ~ curl -4 -v https://tracks4africa.co.za   > /dev/null
> * Rebuilt URL to: https://tracks4africa.co.za/
>   % Total    % Received % Xferd  Average Speed   Time    Time     Time  Current
>                                  Dload  Upload   Total   Spent    Left  Speed
>   0     0    0     0    0     0      0      0 --:--:-- --:--:-- --:--:--     0*   Trying 104.18.54.171...
> * TCP_NODELAY set
> * Connected to tracks4africa.co.za (104.18.54.171) port 443 (#0)
> * TLS 1.2 connection using TLS_ECDHE_ECDSA_WITH_AES_128_GCM_SHA256
> * Server certificate: sni24426.cloudflaressl.com
> * Server certificate: COMODO ECC Domain Validation Secure Server CA 2
> * Server certificate: COMODO ECC Certification Authority
> > GET / HTTP/1.1
> > Host: tracks4africa.co.za
> > User-Agent: curl/7.54.0
> > Accept: */*
> >
> < HTTP/1.1 200 OK
> < Date: Thu, 09 Nov 2017 11:00:20 GMT
> < Content-Type: text/html; charset=utf-8
> < Transfer-Encoding: chunked
> < Connection: keep-alive
> < Set-Cookie: __cfduid=d5f0fa370ad4e5c3d0289f2c82b6d8aff1510225219; expires=Fri, 09-Nov-18 11:00:19 GMT; path=/; domain=.tracks4africa.co.za; HttpOnly
> < Vary: Accept-Language, Cookie
> < X-Frame-Options: SAMEORIGIN
> < Content-Language: en-za
> < Server: cloudflare-nginx
> < CF-RAY: 3bb044851d168082-CPT
> <
> { [930 bytes data]
> 100 27558    0 27558    0     0  27312      0 --:--:--  0:00:01 --:--:-- 27339
> * Connection #0 to host tracks4africa.co.za left intact
>

**Comment by hvisage** [comment]
Adding your httping browser agent:


>  ➜  ~ httping  https://tracks4africa.co.za -s -c 3 -I "Mozilla/5.0 (Macintosh; Intel Mac OS X 10_12_5) AppleWebKit/537.36 (KHTML, like Gecko) Chrome/59.0.3071.115 Safari/537.36"
> Auto enabling SSL due to https-URL
> PING tracks4africa.co.za:443 (/):
> SSL handshake error: (null)
> WRITE_SSL: io-error: Undefined error: 0
> error sending request to host
> WRITE_SSL: io-error: Undefined error: 0
> error sending request to host
> --- https://tracks4africa.co.za/ ping statistics ---
> 3 connects, 0 ok, 100.00% failed, time 3203ms
> ➜  ~

**Comment by flok99** [comment]
@hvisage according to tcpdump, that tracks4africa.co.za immediately disconnects the tcp session before the ssl handshake takes place.

**Comment by hvisage** [comment]
O_o @flok99 not for me it didn't:

for: 

> ➜  ~ httping -v  https://tracks4africa.co.za -s -c 1 -I "curl/7.54.0"
> Auto enabling SSL due to https-URL
> Connecting to host tracks4africa.co.za, port 443 and requesting file /
> 
> PING tracks4africa.co.za:443 (/):
> SSL handshake error: (null)
> --- https://tracks4africa.co.za/ ping statistics ---
> 1 connects, 0 ok, 100.00% failed, time 1057ms
> ➜  ~

I got this: so it at least sent something ` length 361:` from httping, which was rejected by CF:

>➜  ~ sudo tcpdump -e -s 1500 -i en0 -n host 104.18.54.171 or host 104.18.55.171
> tcpdump: verbose output suppressed, use -v or -vv for full protocol decode
> listening on en0, link-type EN10MB (Ethernet), capture size 1500 bytes
> 13:27:57.845728 70:4d:7b:b6:f5:12 > 00:1b:21:71:71:fc, ethertype IPv4 (0x0800), length 78: 10.1.9.83.55047 > 104.18.55.171.443: Flags [S], seq 3526128820, win 65535, options [mss 1460,nop,wscale 5,nop,nop,TS val 675079547 ecr 0,sackOK,eol], length 0
> 13:27:57.869353 00:1b:21:71:71:fc > 70:4d:7b:b6:f5:12, ethertype IPv4 (0x0800), length 66: 104.18.55.171.443 > 10.1.9.83.55047: Flags [S.], seq 2288317469, ack 3526128821, win 29200, options [mss 1460,nop,nop,sackOK,nop,wscale 10], length 0
> 13:27:57.869421 70:4d:7b:b6:f5:12 > 00:1b:21:71:71:fc, ethertype IPv4 (0x0800), length 54: 10.1.9.83.55047 > 104.18.55.171.443: Flags [.], ack 1, win 8192, length 0
> 13:27:57.869552 70:4d:7b:b6:f5:12 > 00:1b:21:71:71:fc, ethertype IPv4 (0x0800), length 361: 10.1.9.83.55047 > 104.18.55.171.443: Flags [P.], seq 1:308, ack 1, win 8192, length 307
> 13:27:57.896675 00:1b:21:71:71:fc > 70:4d:7b:b6:f5:12, ethertype IPv4 (0x0800), length 60: 104.18.55.171.443 > 10.1.9.83.55047: Flags [.], ack 308, win 30, length 0
> 13:27:57.897226 00:1b:21:71:71:fc > 70:4d:7b:b6:f5:12, ethertype IPv4 (0x0800), length 61: 104.18.55.171.443 > 10.1.9.83.55047: Flags [P.], seq 1:8, ack 308, win 30, length 7
> 13:27:57.897265 70:4d:7b:b6:f5:12 > 00:1b:21:71:71:fc, ethertype IPv4 (0x0800), length 54: 10.1.9.83.55047 > 104.18.55.171.443: Flags [.], ack 8, win 8191, length 0
> 13:27:57.897344 70:4d:7b:b6:f5:12 > 00:1b:21:71:71:fc, ethertype IPv4 (0x0800), length 54: 10.1.9.83.55047 > 104.18.55.171.443: Flags [R.], seq 308, ack 8, win 8192, length 0
> 13:27:57.897378 00:1b:21:71:71:fc > 70:4d:7b:b6:f5:12, ethertype IPv4 (0x0800), length 60: 104.18.55.171.443 > 10.1.9.83.55047: Flags [F.], seq 8, ack 308, win 30, length 0
> 13:27:57.897395 70:4d:7b:b6:f5:12 > 00:1b:21:71:71:fc, ethertype IPv4 (0x0800), length 54: 10.1.9.83.55047 > 104.18.55.171.443: Flags [R], seq 3526129128, win 0, length 0
